{
	"schemaVersion":"1.1",
	"systemIdentifier":"ag-pt",
	"phase":{
		"identifier":"liquid",
		"displayName":"Liquid",
		"displayNameStatus":"standard"
	},
	"components":[
		{
			"identifier":"Ag",
			"formula":"Ag",
			"name":"Silver"
		},
		{
			"identifier":"Pt",
			"formula":"Pt",
			"name":"Platinum"
		}
	],
	"compositionVariables":[
		{
			"name":"xPt",
			"quantity":"moleFraction",
			"component":"Pt",
			"role":"independent",
			"definition":"xPt=nPt\/(nAg+nPt); xAg=1-xPt"
		}
	],
	"temperatureRange":{
		"minimum":1.23815e3,
		"maximum":2.1e3,
		"units":"K",
		"rangeBasis":"recommendedUse",
		"notes":"Source-specific 1987 liquid\/FCC assessment in its original pure-liquid reference convention, not SGTE canonical unary integration. Recommended high-temperature use 1238.15-2100 K: lower bound follows source discussion above 965 C; upper bound is an intentional teaching window, not a published validity limit. Low-temperature ordered\/intermediate phases and gas excluded. One FCC function represents both solid solutions. R=8.314 J\/(mol K) is an explicitly chosen rounded reference constant; its precision is not specified in Table 5."
	},
	"modelProvenance":"assessed",
	"intendedUse":[
		"teaching",
		"diagnostic",
		"constrainedEquilibrium"
	],
	"unaryEndpointProvenance":{
		"status":"assessmentSuppliedOriginalLiquidReference",
		"references":[
			"karakaya-thompson-1987"
		],
		"notes":"Table 5 supplies the complete original FCC-minus-liquid functions, with both pure-liquid functions zero. Owner authorized preserving this assessment after the SGTE compatibility audit. Not absolute SER Gibbs energies; do not combine with canonical unary endpoint phases."
	},
	"binaryInteractionProvenance":{
		"status":"assessedParameters",
		"references":[
			"karakaya-thompson-1987"
		],
		"notes":"Table 5 polynomial in xPt converted algebraically, without fitting, to RK powers of xAg-xPt. Solid S_ex=-10.6 xAg xPt J\/(mol K)."
	},
	"gibbsEnergyModel":{
		"quantity":"molarGibbsFreeEnergy",
		"modelType":"idealPlusRedlichKister",
		"units":"J\/mol",
		"expression":{
			"referenceStateContributions":[
				{
					"component":"Ag",
					"standardStatePhase":"Liquid",
					"temperatureSegments":[
						{
							"minimum":1.23815e3,
							"maximum":2.1e3,
							"terms":[
								{
									"basis":"constant",
									"coefficient":0
								}
							]
						}
					]
				},
				{
					"component":"Pt",
					"standardStatePhase":"Liquid",
					"temperatureSegments":[
						{
							"minimum":1.23815e3,
							"maximum":2.1e3,
							"terms":[
								{
									"basis":"constant",
									"coefficient":0
								}
							]
						}
					]
				}
			],
			"idealMixingTerm":{
				"included":true,
				"gasConstant":{
					"value":8.314,
					"units":"J\/(mol K)",
					"parameterOrigin":"referenceConstant"
				}
			},
			"redlichKisterComponentOrder":[
				"Ag",
				"Pt"
			],
			"redlichKisterTerms":[
				{
					"order":0,
					"parameterOrigin":"assessedParameter",
					"temperatureDependence":[
						{
							"basis":"constant",
							"coefficient":2.068975e4
						}
					]
				},
				{
					"order":1,
					"parameterOrigin":"assessedParameter",
					"temperatureDependence":[
						{
							"basis":"constant",
							"coefficient":-7717
						}
					]
				},
				{
					"order":2,
					"parameterOrigin":"assessedParameter",
					"temperatureDependence":[
						{
							"basis":"constant",
							"coefficient":-4.6765e3
						}
					]
				},
				{
					"order":3,
					"parameterOrigin":"assessedParameter",
					"temperatureDependence":[
						{
							"basis":"constant",
							"coefficient":1180
						}
					]
				},
				{
					"order":4,
					"parameterOrigin":"assessedParameter",
					"temperatureDependence":[
						{
							"basis":"constant",
							"coefficient":1.74375e3
						}
					]
				}
			]
		}
	},
	"references":[
		{
			"identifier":"karakaya-thompson-1987",
			"citation":"I. Karakaya and W. T. Thompson, The Ag-Pt (Silver-Platinum) System, Bulletin of Alloy Phase Diagrams 8 (1987) 334-340; Table 5 p.337 and Table 6 p.340.",
			"doi":"10.1007\/BF02869269",
			"role":"originalAssessment"
		}
	],
	"verification":{
		"status":"implementation-validated-with-source-qualifications",
		"transcribedFromSource":true,
		"numericallyValidated":true,
		"ownerValidation":{
			"status":"completed",
			"readerResult":{
				"temperatureK":1.45932e3,
				"liquidMoleFractionPt":0.200761,
				"silverRichFccMoleFractionPt":0.405324,
				"platinumRichFccMoleFractionPt":0.779669
			},
			"cttObservation":"Owner visually confirmed FCC miscibility gap near xPt 0.36-0.825 at 1238.15 K and peritectic Ag-rich contact near 0.405 at 1459.15 K (corrected typo). Visual Pt melting estimate 2046.15 K is approximate; Ag melting is below the supplied window and was not measured.",
			"scope":"Quantitative owner-reader agreement and qualitative owner CTT confirmation; not precise melting-point validation."
		},
		"promotion":{
			"status":"promoted-after-owner-authorization",
			"date":"2026-09-14",
			"stagedPhaseSha256":"c03ccd9e7225e36d73edb0e16cc40a1beb775664fdbf35fd117b6d652ca4c682"
		},
		"validationNotes":"Original 1987 liquid\/FCC equations, not SGTE unary integration. Temperature window 1238.15-2100 K. Table 6 mismatch up to 0.00291044 mole fraction Pt is retained; no coefficient fitting. See validation-diagnostics.json and source-audit.md."
	},
	"representations":{
		"tex":{
			"path":"rendered\/liquid.tex",
			"generated":false,
			"sourceOfTruth":"gibbsEnergyModel"
		},
		"pdf":{
			"path":"rendered\/liquid.pdf",
			"generated":false,
			"sourceOfTruth":"gibbsEnergyModel"
		}
	},
	"notes":"Source-specific 1987 liquid\/FCC assessment in its original pure-liquid reference convention, not SGTE canonical unary integration. Recommended high-temperature use 1238.15-2100 K: lower bound follows source discussion above 965 C; upper bound is an intentional teaching window, not a published validity limit. Low-temperature ordered\/intermediate phases and gas excluded. One FCC function represents both solid solutions. R=8.314 J\/(mol K) is an explicitly chosen rounded reference constant; its precision is not specified in Table 5."
}